{
  "$schema": "../../../schemas/starter-pack.schema.json",
  "schemaVersion": "starter-pack/v1",
  "id": "design.stylekit-adapted",
  "version": "0.1.0",
  "source": {
    "name": "StyleKit normalized direction",
    "url": "https://github.com/AnxForever/stylekit",
    "revision": "29141b684d5abb967558eb8083fbae91dbbc51b8",
    "license": "MIT",
    "relationship": "adapted-donor"
  },
  "files": [],
  "dependencies": [],
  "routes": []
}
